SHINEuid,MonType,HER Number,Name,PrtctStat,Summary,PeriodStrt,PeriodEnd,Evidence,Descript,PrimRefNo,SHINE_name,CandStat,SHI_Form,SHI_Signif,SHI_StatID,SHI_Stat,Shape,BroadType_Code,Keep_YN.x,Keep_YN.y,countNoKeep,countSHINEuids
36278,LEAT,31794,"Leat on the western side of Thirlmere Valley, St. John's Castlerigg and Wythburn",,"Site of a leat (artificial water channel, usually leading to a mill) of Modern date.",20TH CENTURY,20TH CENTURY,STRUCTURE,"A large concrete leat, 3m wide, 1m deep and made of solid concrete, which zigzags its way across the landscape east of Thirlmere. It is a water catchment leat which takes all the water off Helvellyn and drains it into Thirlmere reservoir. This site was l",98847b26-994a-4f00-a8a8-47e4850b6c20,Above-ground remains of a modern leat and cairn of unknown date at St John's Castlerigg and Wythburn,yes,Above-ground feature(s),Medium,2,Probable,Line,NA,N,N,1,1
36280,BIELD,31805,"Bield at Fisher Place, Thirlmere",,Site of a bield (a wall built to give shelter to sheep) of Post Medieval date.,POST MEDIEVAL,POST MEDIEVAL,STRUCTURE,A 10m long linear bield running east to west up the side of the valley and standing to a height of 1.6m in places. This site was located during field survey conducted by LUAU in 1996 (S1898).,c821e7e3-4b7e-49c2-a6c6-6e9ad134b39c,"Structural remains of a post-medieval bield at Fisher Place, Thirlmere",yes,Structure(s),Medium,2,Probable,Point,1,N,N,1,1
36297,BIELD,31842,"Bield at Brown Rigg, Thirlmere",,Site of a bield (a wall built to give shelter to sheep) or sheep fold (a pen or enclosure used for containing sheep) of Post Medieval date.,POST MEDIEVAL,POST MEDIEVAL,STRUCTURE,"A large bield, or possibly a sheepfold, with two components possibly showing two phases of construction. The first component is a roughly sub-circular drystone enclosure measuring 7m x 5m and standing up to 1m in height. The second component is attached",3bade9a0-a49d-4063-97cc-a4db1e84ec2d,"Structural remains of a post-medieval bield at Brown Rigg, Thirlmere",yes,Structure(s),Medium,2,Probable,Point,1,N,N,1,1
36301,BIELD,31846,"Bield at Hawes Gill, Thirlmere",,Site of a bield (a wall built to give shelter to sheep) of Post Medieval date.,POST MEDIEVAL,POST MEDIEVAL,STRUCTURE,A section of reasonably well constructed drystone walling measuring 3m in length and standing to a maximum height of 0.7m at the downslope end. It lies at the base of a crag next to a natural hollow and is probably a small shelter or bield. This site was,622a5889-3582-4bc3-bb3e-11dd1c1211a5,"Structural remains of a post-medieval bield at Hawes Gill, Thirlmere",yes,Structure(s),Medium,2,Probable,Point,1,N,N,1,1
36306,BIELD,31851,"Bields at Hawes Gill, Thirlmere",,Site of two bields (walls built to give shelter to sheep) of Post Medieval date.  See nearby HER 31850.,POST MEDIEVAL,POST MEDIEVAL,STRUCTURE,"A small 4m in diameter, semi-circular drystone bield. It is crudely built, with partially collapsed walls that incorporate large stones and are 0.8m thick. Just outside this bield is another smaller bield of 1m diameter standing to 1.8m in height. They a",7f96fada-957a-4bb8-ba21-e2723460e7e0,"Structural remains of post-medieval bields at Hawes Gill, Thirlmere",yes,Structure(s),Medium,2,Probable,Point,1,N,N,1,1
36308,BIELD,31853,"Bield at Hawes Gill, Thirlmere",,Site of the remains of a bield (a wall built to give shelter to sheep) of Post Medieval date.,POST MEDIEVAL,POST MEDIEVAL,STRUCTURE,"A 15m long and very badly decayed bield, with a cleared level interior situated east of a boundary wall. The southern end is curved and runs north to south forming a small shelter site. This site was located during field survey conducted by LUAU in 1996",9aa14174-2f92-4cd5-82e3-7ed2414141b0,"Structural remains of a post-medieval bield at Hawes Gill, Thirlmere",yes,Structure(s),Medium,2,Probable,Point,1,N,N,1,1
36319,BIELD,31864,"Bield at Brown Rigg, Thirlmere",,Site of a bield (a wall built to give shelter to sheep) of Post Medieval date.,POST MEDIEVAL,POST MEDIEVAL,STRUCTURE,"A small well made drystone bield built onto a large boulder. The site is 7m in length, stands to 1.7m high with a wall width of 0.7m. The site is orientated  east to west and overlooks the lake. This site was located during field survey conducted by LUAU",6f44cbbe-576e-49e9-bac0-8ec860e5f838,"Structural remains of a post-medieval bield at Brown Rigg, Thirlmere",yes,Structure(s),Medium,2,Probable,Point,1,N,N,1,1
36320,BIELD,31865,"Bield at Brown Rigg, Thirlmere",,Site of a bield (a wall built to give shelter to sheep) of Post Medieval date.,POST MEDIEVAL,POST MEDIEVAL,STRUCTURE,A run down 7m long bield which is built around boulders. The 7m long section of wall stands to 0.5m in height with a width of 0.8m and is virtually destroyed. This site was located during field survey conducted by LUAU in 1996 (S1898).,52dc8e1c-9f99-4452-87e4-bd7fdf8d1377,"Structural remains of a post-medieval bield at Brown Rigg, Thirlmere",yes,Structure(s),Medium,2,Probable,Point,1,N,N,1,1
36321,BIELD,31866,"Bield at Brown Rigg, Thirlmere",,Site of a bield (a wall built to give shelter to sheep) of Post Medieval date.,POST MEDIEVAL,POST MEDIEVAL,STRUCTURE,"A large crescent shaped bield, measuring 18m across with a 25m long drystone wall standing to 1.3m in height. The site is situated halfway down the slope and has another small roughly circular bield to the south of it which is poorly built and this measu",8c9e0220-881b-48ca-8230-728942a3fe32,"Structural remains of a post-medieval bield at Brown Rigg, Thirlmere",yes,Structure(s),Medium,2,Probable,Point,1,N,N,1,1
36329,BIELD,31883,"Bield at West Head, Thirlmere",,Site of a bield (a wall built to give shelter to sheep) of Post Medieval date.,POST MEDIEVAL,POST MEDIEVAL,STRUCTURE,A roughly 'L' - shaped bield measuring 14m east/west and 4m north/south with a very well constructed western corner standing to 1.8m and the rest standing to 0.4m. This site was located during field survey conducted by LUAU in 1996 (S1898).,e2867e71-a51c-4dfe-8932-7ba056140cae,"Structural remains of a post-medieval bield at West Head, Thirlmere",yes,Structure(s),Medium,2,Probable,Point,1,N,N,1,1
36341,BIELD,31897,"Bield at Ullscarf Gill, Thirlmere",,Site of a bield (a wall built to give shelter to sheep) of Post Medieval date.,POST MEDIEVAL,POST MEDIEVAL,STRUCTURE,A 5m x 4m sub-rectangular bield with an entrance on its southern side and a large crag to its western side. A short stretch of wall heads off east from its north-western corner for 4m and stands to 0.5m in height. This site was located during field surve,03ec067f-d813-49c2-90d0-64d8edd35e7a,"Structural remains of a post-medieval bield at Ullscarf Gill, Thirlmere",yes,Structure(s),Medium,2,Probable,Point,1,N,N,1,1
36343,BIELD,31899,"Bield at Birk Side, Thirlmere",,Site of the remains of a bield (a wall built to give shelter to sheep) of Post Medieval date.,POST MEDIEVAL,POST MEDIEVAL,STRUCTURE,"A collapsed and partially earthfast arc-shaped bield measuring 12m long and 1.5m high, the site is aligned east west on a fairly steep slope below a crag. This site was located during field survey conducted by LUAU in 1996 (S1898).",6dd1d537-d58c-4a87-b610-19989c2f550b,"Structural remains of a post-medieval bield at Birk Side, Thirlmere",yes,Structure(s),Medium,2,Probable,Point,1,N,N,1,1
36344,BIELD,31900,"Bield at Ullscarf Gill, Thirlmere",,Site of a bield (a wall built to give shelter to sheep) of Post Medieval date.,POST MEDIEVAL,POST MEDIEVAL,STRUCTURE,A bield built on to the side of a crag which comprises two arms of drystone wall which come out from the crag. The first is 8m long and 1.3m high and the second is 1.5m long and 1m high. This site was located during field survey conducted by LUAU in 1996,149597d6-1f54-435f-a4d2-ea1d09aee4f2,"Structural remains of a post-medieval farmhouse at Ullscarf Gill, Thirlmere",yes,Structure(s),Medium,2,Probable,Point,1,N,N,1,1
36348,BIELD,31904,"Bield at Nab Crags, Thirlmere",,Site of a bield (a wall built to give shelter to sheep) of Post Medieval date.,POST MEDIEVAL,POST MEDIEVAL,STRUCTURE,"A linear 20m long drystone bield orientated roughly north south, running through and utilising a series of large boulders. This site was located during field survey conducted by LUAU in 1996 (S1898).",890e0ccb-edef-4025-a8a8-0b8da7fc2184,"Structural remains of a post-medieval bield at Nabs Crags, Thirlmere",yes,Structure(s),Medium,2,Probable,Point,1,N,N,1,1
36350,BIELD,31906,"Bield at Steel End, Thirlmere",,Site of a bield (a wall built to give shelter to sheep) of Post Medieval date.,POST MEDIEVAL,POST MEDIEVAL,STRUCTURE,An 18m long linear drystone bield standing to a height of about 1.4m. This site was located during field survey conducted by LUAU in 1996 (S1898).,4f198b1f-ee32-4d5b-8b22-b2aeff1b0fd0,"Structural remains of a post-medieval bield at Steel End, Thirlmere",yes,Structure(s),Medium,2,Probable,Point,1,N,N,1,1
36355,BIELD,31912,"Bields at Nab Crags, Thirlmere",,Site of the remains of two bields (walls built to give shelter to sheep) of Post Medieval date.,POST MEDIEVAL,POST MEDIEVAL,STRUCTURE,A series of two diminished small bields. One wall runs east to west for 10m and stands to 0.6m in height and butts a boulder at one end and a small crag at the other. East of this wall is a very small north to south orientated bield which simply provides,cf996ac8-7ca8-48cc-84b5-8604a96557fc,"Structural remains of post-medieval bields at Nabs Crags, Thirlmere",yes,Structure(s),Medium,2,Probable,Point,1,N,N,1,1
36357,BIELD,31914,"Bield at Wyth Burn, Thirlmere",,Site of a bield (a wall built to give shelter to sheep) and a sheep fold (a pen or enclosure used for containing sheep) of Post Medieval date.,POST MEDIEVAL,POST MEDIEVAL,STRUCTURE,A large semi-circular wall forming a large bield which stands immediately to the east of Wythburn Gill and is situated on the southern side of a westerly running drystone wall. It forms a large arc from the wall measuring about 25m x 12m. The walling has,daf7af6a-4f93-4815-b521-06ccfecb6591,"Structural remains of a post-medieval bield at Wythburn, Thirlmere",yes,Structure(s),Medium,2,Probable,Point,1,N,N,1,1
36359,BIELD,31916,"Bield at Blackcrag Gill, Thirlmere",,Site of a bield (a wall built to give shelter to sheep) of Post Medieval date.,POST MEDIEVAL,POST MEDIEVAL,STRUCTURE,A 25m long stretch of arced drystone walling in good condition. It stands to 2m high in places with intact coping stones. The walls are fairly wide at around 1m in width and incorporate some large boulders in the construction. This length of wall has a l,6d61567d-7c7b-4e8f-b283-c5d80f49a15b,"Structural remains of a post-medieval bield at Blackcrag Gill, Thirlmere",yes,Structure(s),Medium,2,Probable,Point,1,N,N,1,1
36360,BIELD,31917,"Bield at Nab Crags, Thirlmere",,Site of a bield (a wall built to give shelter to sheep) of Post Medieval date.,POST MEDIEVAL,POST MEDIEVAL,STRUCTURE,A large 'L'-shaped bield in good condition standing to 1.3m in height in some places and built in a slight hollow in the valley side around some large boulders. The two arms of walling creating the 'L' are 15m long and 12m long respectively and the short,ffbedcb9-d817-4b99-83a6-13e36feb1af7,"Structural remains of a post-medieval bield at Nabs Crags, Thirlmere",yes,Structure(s),Medium,2,Probable,Point,1,N,N,1,1
36376,BIELD,31934,"Bield at Red Brow, Thirlmere",,Site of a bield (a wall built to give shelter to sheep) of Post Medieval date.,POST MEDIEVAL,POST MEDIEVAL,STRUCTURE,A 'T'-shaped bield which measures 20m x 15m and located on an area of undulating enclosed land heading up towards Dunmail Raise. It is well made with walls standing to 1.5m in height. This site was located during field survey conducted by LUAU in 1996 (S,a588a5e1-61ae-48c2-b230-d43378b4db50,"Structural remains of a post-medieval bield at Red Brow, Thirlmere",yes,Structure(s),Medium,2,Probable,Point,1,N,N,1,1
36387,BIELD,31953,"Bield at Flask Brow, Torver High Common",,Site of a bield (a wall built to give shelter to sheep) of unknown date.,UNCERTAIN,UNCERTAIN,STRUCTURE,"A semi-circular dry stone structure, with the masonry standing up to 4-5 courses in height. It is partly decayed and set up against coarse scree. It was probably a temporary shelter/bield. This site was identified during a LUAU survey of Torver High Comm",3540f38b-a0f8-4360-be3b-f6ff2a21cffa,"Structural remains of a bield of unknown date at Flask Brow, Torver",yes,Structure(s),Medium,2,Probable,Point,1,N,N,1,1
36406,BIELD,31974,"Bield at Green Rigg Bank, Torver High Common",,Site of a bield (a wall built to give shelter to sheep) of Post Medieval date.,POST MEDIEVAL,POST MEDIEVAL,STRUCTURE,A small bield butting against a dry stone enclosure wall. It stands to a height of 2 courses high and is composed of dry stone masonry. It is 6.4m long and 3.1m wide. It is not of great antiquity. This site was identified during a LUAU survey of Torver H,0bb7484b-a2e3-4902-b848-27c9c8572c78,"Structural remains of a post-medieval bield at Green Rigg Bank, Torver",yes,Structure(s),Medium,2,Probable,Point,1,N,N,1,1
36467,VERMIN TRAP,32132,"Fox Bield, Great How Crags, Levers Water, Coniston",,Site of a fox trap (a device used to trap or kill foxes) of Post Medieval date.,POST MEDIEVAL,POST MEDIEVAL,STRUCTURE,"At the base of Great How Crags, amongst a large boulder field, Peter Fleming has recorded a fox trap (S1855 p. 269-276). It is probably only 65% intact, but is a fine example of a fox trap. It was built by skilled dry stone wallers, as it has a neat, clo",ef15137b-eca4-4fea-9911-92cc078c7162,Structural remains of a post-medieval fox trap at Great How Crags. Coniston,yes,Structure(s),Medium,2,Probable,Point,NA,N,N,1,1
36468,VERMIN TRAP,32133,"Fox Bield, Great Borne, Ennerdale",,Site of a fox trap (a device used to trap or kill foxes) of Post Medieval date.,POST MEDIEVAL,POST MEDIEVAL,STRUCTURE,"This fox trap has been restored in recent years and is therefore, about 95% intact. The trap has a stone ramp built to its top on the north side, linking it to the source of stone from which it was built. It is cited in a small heathery hollow. To the ea",67124715-d44f-4d8e-ad23-0de7d8aee3cc,"Structural remains of a post-medieval to modern fox trap at Great Borne, Ennerdale and Kinniside",yes,Structure(s),Medium,2,Probable,Point,NA,N,N,1,1
36469,VERMIN TRAP,32135,"Fox Bield, Hare Crag, Wha House, Eskdale",,Site of a fox trap (a device used to trap or kill foxes) of Post Medieval date.,POST MEDIEVAL,POST MEDIEVAL,STRUCTURE,"A fox trap situated near the top of the crag on a grassy plateau. It is 70% intact, with the floor area covered with the collapsed wall rubble from the north side, which is adjacent to the fell slope. Parts of the internal walls still retain pronounced o",84377b6b-6983-4cf4-bdef-70565276e1f0,"Structural remains of a post-medieval fox trap at Hare Crag, Eskdale",yes,Structure(s),Medium,2,Probable,Point,NA,N,N,1,1
36470,VERMIN TRAP,32136,"Fox Bield, Great Blake Rigg, Seathwaite",,Site of a fox trap (a device used to trap or kill foxes) of Post Medieval date.,POST MEDIEVAL,POST MEDIEVAL,STRUCTURE,"A stone fox trap, 60% intact. It appears to have fallen in on itself and is partly filled with its own rubble. Many large boulders were used in its construction. The overhang of the internal walls is still evident. This trap must have been originally ove",127272f4-6c29-4b8b-a625-49c6e1bb041e,"Structural remains of post-medieval fox traps at Great Blake Rigg, Seathwaite",yes,Structure(s),Medium,2,Probable,Point,NA,N,N,1,1
36472,VERMIN TRAP,32138,"Fox Bield, Stonestar, Ulpha",,Site of a fox trap (a device used to trap or kill foxes) of Post Medieval date.,POST MEDIEVAL,POST MEDIEVAL,STRUCTURE,"This fox trap was built in an area of borran (a large boulder field, where there are often small caves and recesses where foxes breed and where they go to 'earth' if pursued) in a rocky gully immediately north east of the larger gully containing the loca",1ffb05cb-67ee-4877-a14d-054f213166cb,"Structural remains of a post-medieval fox trap at Stonestar, Dunnerdale-with-Seathwaite",yes,Structure(s),Medium,2,Probable,Point,NA,N,N,1,1
36473,BIELD,32140,"Goose Bield, Wha House, Eskdale",,Site of a goose bield (an enclosure or pen for confining geese) of Post Medieval date.,POST MEDIEVAL,POST MEDIEVAL,STRUCTURE,A large goose bield at the base of a crag with an external diameter of 8.6m. The walls stand 1.6m high and are 0.6m thick. There is no entrance. The walls on the north and eastern sides are still capped with large angular blocks which overhang on the out,78b494f0-d0f9-4073-adbe-fef967668e8c,"Structural remains of a post-medieval goose bield at Wha House, Eskdale",yes,Structure(s),Medium,2,Probable,Point,1,N,N,1,1
36474,BIELD,32141,"Goose Bield, Stanley Ghyll",,Site of a goose bield (an enclosure or pen for confining geese) of Post Medieval date.,POST MEDIEVAL,POST MEDIEVAL,STRUCTURE,"A roughly oblong goose bield, with round corners, measuring 4m x 3.3m. The walls are 1m thick and stand to 1m high. No entry is provided. This bield is built in a sheltered hollow and is only visible from close proximity (S1855 p. 269-276).",c8f70316-eae3-47e0-88c5-381c6d8239fa,"Structural remains of a post-medieval goose bield at Stanley Ghyll, Eskdale",yes,Structure(s),Medium,2,Probable,Point,1,N,N,1,1
36535,NUCLEAR BUNKER,32582,"Observer Corps bunker, High Gate, Bigland",,"Site of a bunker (a structure, often built undergound, used for defence and co-ordination of military activity) of Modern (twentieth century) date.",20TH CENTURY,20TH CENTURY,RUINED BUILDING,"Civil defence bunker of standard design, including vertical shaft entrance with ladder and two air vents. Located on site visit (S2859).",f6b60c1f-2a17-49aa-9c3b-798316c5cce0,"Structural remains of a modern bunker at Bigland, Haverthwaite",yes,Structure(s),Medium,2,Probable,Point,5,N,N,1,1
36631,BIELD,32957,"Possible Bield at Comb Crags, Ennerdale and Kinniside",,Possible bield (a wall built to give shelter to sheep) of unknown date.,UNCERTAIN,UNCERTAIN,STRUCTURE,"A possible bield identified by OS Aerial Photography (S1889, number 75).
~
Site recorded in The National Trust Sites and Monuments Record from the survey work carried out (S2873).",a87110dd-0270-4738-937e-86d0f6093281,"Above-ground remains of a bield of unknown date at Comb Crags, Ennerdale and Kinniside",yes,Above-ground feature(s),Medium,1,Possible,Point,1,N,N,1,1
36636,BIELD,32963,"Bield at Gillercomb Head, Ennerdale and Kinniside",,Bield (a wall built to give shelter to sheep) of post medieval date.,POST MEDIEVAL,POST MEDIEVAL,STRUCTURE,"A sheep shelter/bield shown on aerial photographs. During a field survey conducted by OAN in 2003 the bield was recorded as consisting of a curved dry-stone wall forming a sub-circular shelter. The wall stands 1.3m high, is 0.6m thick and 10m in diameter",aa38c5b2-85b0-4145-95b4-af5b5c495ad9,"Structural remains of a post-medieval bield at Gillercomb Head, Ennerdale and Kinniside",yes,Structure(s),Medium,2,Probable,Point,1,N,N,1,1
36660,BIELD,32996,"Bield at Gillflinter Beck, Ennerdale and Kinniside",,Bield (a wall built to give shelter to sheep) of post medieval date.,POST MEDIEVAL,POST MEDIEVAL,STRUCTURE,"A small bield located to the east of Gillflinter Beck. It is roughly triangular, and of an uneven dry-stone construction. Apart from the east wall, it is denuded and only survives as 4 courses of scree stones piled in a wall. These are sub-rounded and su",312553f0-4fa6-4dc6-b649-def2a1d8a7cd,"Structural remains of a post-medieval bield at Gillflinter Beck, Ennerdale and Kinniside",yes,Structure(s),Medium,2,Probable,Point,1,N,N,1,1
36661,BIELD,32998,"Bield at Gillflinter Beck, Ennerdale and Kinniside",,Bield (a wall built to give shelter to sheep) of post medieval date.,POST MEDIEVAL,POST MEDIEVAL,STRUCTURE,A small 'question mark' shaped dry-stone shelter. It is approximately 6m long by 2m wide and its walls are 0.6m wide by 0.6m high. The walls consist of 4 rough courses of small to medium sub-rounded scree. This site was located during field survey conduc,2fc08eb1-50b4-4f53-b30e-adacf92d7a44,"Structural remains of a post-medieval bield at Gillflinter Beck, Ennerdale and Kinniside",yes,Structure(s),Medium,2,Probable,Point,1,N,N,1,1
36665,LEAT,33007,"Leat at Bowness Knott, Ennerdale and Kinniside",,"Leat (artificial water channel, usually leading to a mill) of post medieval date.",POST MEDIEVAL,POST MEDIEVAL,EARTHWORK,"A water smoot from a channel running through the field, and likely to date from the Enclosure Act (mid 18th century-early 19th century). This site was located during field survey conducted by OAN in 2003 (S1889).",9f1cf3bf-ad5c-4c9b-af61-460dc5110166,"Above-ground remains of a post-medieval leat at Bowness Knott, Ennerdale and Kinniside",yes,Above-ground feature(s),Medium,2,Probable,Point,NA,N,N,1,1
36708,BIELD,33106,"Bields at Barwick House, St. John's Castlerigg and Wythburn",,Bields (walls built to give shelter to sheep) of post medieval date.,POST MEDIEVAL,POST MEDIEVAL,DOCUMENTARY EVIDENCE,"Several bields are shown and named on the OS 1st edition 6"" map, one is shown on the OS 2nd edition 6"" map and two appear on the current OS mapping. This site was located during a field survey conducted by LUAU in 1996 (S1898).",2bd42c2f-8d21-4ce8-bd7e-245a39e34d5c,"Structural remains of post-medieval bields at Barwick House, St John's Castlerigg and Wythburn",yes,Structure(s),Medium,2,Probable,Point,1,N,N,1,1
36726,COPPER MINE,17944,"Hay Gill  Copper Mine, Caldbeck",,Site of a copper mine of Post Medieval date.,POST MEDIEVAL,POST MEDIEVAL,EARTHWORK,"A very small late C18th stamping mill ? Site and adjacent earlier workings on a rare area of flat ground in Hay Gill.  Consists of wheelpit with building ? (left bank) and two roomed building (right bank). The site is ruinous, but a relatively rare survi",c6aa8734-b291-491c-aafc-aed6c82182c4,"Above-ground remains of a post-medieval copper mine at Hay Gill, Caldbeck",yes,Above-ground feature(s),Medium,2,Probable,Point,2,N,N,1,1
36770,HOLLOW,33244,"Park Beck hollow, Kentmere",,"An earthwork hollow (hollow, concave formation or place, which has sometimes been dug out) - possibly man-made - has been recorded in field survey work. It is unknown what date or function this might have had.",UNCERTAIN,UNCERTAIN,EARTHWORK,"Hollow recorded by the 1984 SEARCH project; the remains are a slight penanular hollow facing South in slightly sloping ground. The hollow is some 4.5m x 9.4m in internal area. Possible internal features, such as walls, were recorded in the initial record",ab620cca-3729-467b-b928-80676e9d93d9,"Above-ground remains of a hollow way of unknown date at Park Beck, Kentmere",yes,Above-ground feature(s),Medium,2,Probable,Point,NA,N,N,1,1
36878,BIELD,60177,"Bield, West of Kilnstones Wood, Longsleddale",,A bield (a wall built to give shelter to sheep) of medieval to post medieval date.,MEDIEVAL,POST MEDIEVAL,STRUCTURE,"A dry stone walled structure with a rough plan based on three sides of a square, open to the west up the hill. No entrance is discernible. The structure measures approximately 10m square and stands to a height of 1.3m. The site was identified during a wa",24047bc9-e2d8-440e-bcc1-cf942cff7aaa,"Structural remains of a bield (a shelter for sheep) of post medieval date at Kilnstones,Longsleddale",yes,Structure(s),Low,2,Probable,Point,1,N,N,1,1
36907,VERMIN TRAP,60224,"Fox Bield, Broad End, Underskiddaw",,A Fox Bield (a device used to trap or kill foxes) of possible post medieval date.,POST MEDIEVAL,POST MEDIEVAL,EARTHWORK,A Fox Bield identified on an OS mastermap during documentary research. (S5107),ed201611-76e3-456a-a18b-54555654feeb,"Above-ground feature of a  Fox Bield, Broad End, Underskiddaw",yes,Above-ground feature(s),Medium,2,Probable,Polygon,NA,N,N,1,1
36953,BIELD,60044,"Bield on the northern slopes of Broad Crag, Great Langdale",,"This is a small sub-rectangular, structure set against a steep slope. The walls are of dry-stone construction and they stand to about two or three courses high.",MEDIEVAL,POST MEDIEVAL,STRUCTURE,"(OA North site visit 2005) This is a small sub-rectangular, structure set against a steep slope. The walls are of dry-stone construction and they stand to about two or three courses high. Four sides of a sub-rectangular structure are present one of which",e1d7c54e-828d-462b-b257-7b1573b0853d,"Above-ground feature, Bield on the northern slopes of Broad Crag, Great Langdale",yes,Above-ground feature(s),Low,2,Probable,Point,1,N,N,1,1
36973,LEAD MINE,1226,"Gold Scope Copper and Lead Mines, Above Derwent",Scheduled Monument,Copper mine of Medieval to Post-Medieval date.  Also the site of lead extraction in the Industrial period (19th century).  Scheduled Ancient Monument no. 34954.,MEDIEVAL,POST MEDIEVAL,DESTROYED MONUMENT,"Copper-lead workings at Goldscope at the SE foot of the Newlands Vale were worked by the Company of Mines Royal in C16.  Now disused (S1086).
~
The Goldscope mine (the name deriving via local corruption from the German Gottesgab = God's Gift) in the Ne",68bae2ce-aa89-41f0-a479-3374357847b8,"Above-, below-ground and structural remains of a medieval to post-medieval copper mine at Goldscope",yes,Structure(s) + above + below-ground feature(s),Medium,2,Probable,Polygon,NA,N,N,2,2
