SHINEuid,MonType,HER Number,Name,PrtctStat,Summary,PeriodStrt,PeriodEnd,Evidence,Descript,PrimRefNo,SHINE_name,CandStat,SHI_Form,SHI_Signif,SHI_StatID,SHI_Stat,Shape,BroadType_Code,Keep_YN.x,Keep_YN.y,countNoKeep,countSHINEuids
38967,BIELD,35477,"Bield northeast of Seatoller, Borrowdale",,This V+shaped bield (wall built to give shelter to sheep) wall is on the hillside northeast of Seatoller.,POST MEDIEVAL,POST MEDIEVAL,STRUCTURE,"This V-shaped shelter wall is just below the intake wall. One wall is 9.0m long the other is 7.0m long, both walls rise to a height of 1.25 metres. This shelter wall has thick wall and is in good condition (Borrowdale Notebook 1).",b55c3c81-9c92-4988-9748-0803ed168de7,"Structural remains of a bield of unknown date at Seatoller, Borrowdale",yes,Structure(s),Medium,2,Probable,Point,1,N,N,1,1
38973,BIELD,35484,"Bield North of Seatoller, Borrowdale",,This curved bield (wall built to give shelter to sheep) is built on an outcrop of rock North of Seatoller.,POST MEDIEVAL,POST MEDIEVAL,STRUCTURE,This curved shelter wall is built on top of a rock outcrop; the walls rise to over 1.25m high (Borrowdale Notebook 1).,37f3a4e4-d796-426c-9ead-5c6ab93b76f6,"Structural remains of a bield of unknown date at Seatoller, Borrowdale",yes,Structure(s),Medium,2,Probable,Point,1,N,N,1,1
38978,BIELD,35489,"Bield northwest of Seatoller, Borrowdale",,This large bield (wall built to give shelter to sheep) is situated on the hillside northwest of Seatoller.,POST MEDIEVAL,POST MEDIEVAL,STRUCTURE,This long shelter wall is over 1.25m high. It is built up against a rock outcrop on a steep hillside (Borrowdale Notebook 1).,28480d7f-029b-406e-840c-4fb357d8181b,"Structural remains of a bield of unknown date at Seatoller, Borrowdale",yes,Structure(s),Medium,2,Probable,Point,1,N,N,1,1
38979,BIELD,35490,"Bield West of High Doat, Borrowdale",,This large bield (wall built to give shelter to sheep) is built against a large boulder West of High Doat.,POST MEDIEVAL,POST MEDIEVAL,STRUCTURE,Built against a large boulder is a 7.0m long wall that is 1.0m high (Borrowdale Notebook 1).,bf3fbe8f-f466-4548-be81-d2d31471198f,"Structural remains of a bield of unknown date at High Doat, Borrowdale",yes,Structure(s),Medium,2,Probable,Point,1,N,N,1,1
38980,BIELD,35491,"Bield northwest of Seatoller, Borrowdale",,This large bield (wall built to give shelter to sheep) is set on the hillside northwest of Seatoller.,POST MEDIEVAL,POST MEDIEVAL,STRUCTURE,This broadly curving shelter wall is 15.0m long with a maximum wall height of 1.0m (Borrowdale Notebook 1).,217e4a93-8c58-4de9-9a2a-fbad4480905d,"Structural remains of a bield of unknown date at Seatoller, Borrowdale",yes,Structure(s),Medium,2,Probable,Point,1,N,N,1,1
38982,BIELD,35493,"Bield North of Hause Gill, Borrowdale",,This bield (wall built to give shelter to sheep) is situated on the hillside North of Hause Gill.,POST MEDIEVAL,POST MEDIEVAL,EARTHWORK,"Only the footing stones remain for this site, it is over 11m long with two boulders at either end of the site (Borrowdale Notebook 1).",93cc45bc-ddb6-4e32-974c-6cdfaaba7abf,"Structural remains of a bield of unknown date at Hause Gill, Borrowdale",yes,Structure(s),Medium,2,Probable,Point,1,N,N,1,1
38987,BIELD,35498,"Bield northeast of Honister Hause, Borrowdale",,Situated on the hillside northeast of Honister House is a bield (wall built to give shelter to sheep).,POST MEDIEVAL,POST MEDIEVAL,STRUCTURE,This 9.0m long shelter wall is over 0.75m high. This is associated with several other sites along the hillside (Borrowdale Notebook 1).,88435707-ba32-4545-95a1-679a073ffbd8,"Structural remains of a bield of unknown date at Honister Hause, Borrowdale",yes,Structure(s),Medium,2,Probable,Point,1,N,N,1,1
38988,BIELD,35499,"Bield northeast of Honister Hause, Borrowdale",,This ruined bield (wall built to give shelter to sheep) is situated on the hillside northeast of Honister House.,POST MEDIEVAL,POST MEDIEVAL,STRUCTURE,This 6.0m long shelter wall is 0.75m high and is L-shaped (Borrowdale Notebook 1).,eb0b79a5-6f46-4796-9359-41e9934d695b,"Structural remains of a bield of unknown date at Honister Hause, Borrowdale",yes,Structure(s),Medium,2,Probable,Point,1,N,N,1,1
38989,BIELD,35500,"Bield North of Hause Gill, Borrowdale",,This ruinous bield (wall built to give shelter to sheep) shelter wall is situated North of Hause Gill.,POST MEDIEVAL,POST MEDIEVAL,STRUCTURE,This 15m length of curved wall rises to a height of 1.0m. There is a small area of levelled ground immediately behind the wall (Borrowdale Notebook 1).,12efc3b9-0d54-4cc9-a0b5-0e05f4e77475,"Structural remains of a bield of unknown date at Hause Gill, Borrowdale",yes,Structure(s),Medium,2,Probable,Point,1,N,N,1,1
38993,BIELD,35504,"Bield West of Seatoller Farm,Borrowdale",,This bield (wall built to give shelter to sheep) measures 12m and is situated on the hillside West of Seatoller Farm.,POST MEDIEVAL,POST MEDIEVAL,STRUCTURE,"This bield is curved and has an entrance in the centre that projects 2m outwards, giving it a slight funnel shape.The whole feature runs for 21m and is 1m in height.",122a6c90-30db-45c2-8df1-a75573e5c180,"Structural remains of a bield of unknown date at Seatoller Farm, Borrowdale",yes,Structure(s),Medium,2,Probable,Point,1,N,N,1,1
38994,BIELD,35505,"Bield West of Seatoller Farm, Borrowdale",,This small bield (wall built to give shelter to sheep) is situated on the sloping hillside West of Seatoller Farm,POST MEDIEVAL,POST MEDIEVAL,STRUCTURE,This feature is a small section of crudely-built shelter wall measuring 5m in length with a height of 1m. It is orientated southeast to northwest (Borrowdale Notebook 2).,1c44fdae-1e71-4644-b69a-0226de93f8ab,"Structural remains of a bield of unknown date at Seatoller Farm, Borrowdale",yes,Structure(s),Medium,2,Probable,Point,1,N,N,1,1
38997,BIELD,35508,"Bield southeast of Little Gatesgarthdale, Borrowdale",,"Situated on the hillside southeast of Little Gatesgarthdale is a stretch of destroyed bield (wall built to give shelter to sheep), originally used to provide shelter for livestock.",POST MEDIEVAL,POST MEDIEVAL,EARTHWORK,Situated on the hillside southeast of Little Gatesgarthdale is a stretch of wall. 14m in length destroyed down to its footings. It is orientated southeast to northwest and was originally intended to provide shelter for livestock on the exposed fells.,e90ea8e9-0ef1-49da-8746-357f8ee9f6a6,"Structural remains of a bield of unknown date at Little Gatesgarthdale, Borrowdale",yes,Structure(s),Medium,2,Probable,Point,1,N,N,1,1
39071,BIELD,36556,"Bield northwest of Tongue House High Close, Duddon",,This bield (wall built to give shelter to sheep) is situated on the hillside northwest of Tongue House High Close.,POST MEDIEVAL,POST MEDIEVAL,UNCERTAIN EVIDENCE,Bield.,569c3eb7-9e67-4828-a068-ce0ed24a01b4,"Structural remains of a bield of unknown date at Tongue House High Close, Dunnerdale-with-Seathwaite",yes,Structure(s),Medium,1,Possible,Point,1,N,N,1,1
39083,BIELD,36568,"Bield East of Tongue House, Duddon",,This bield (wall built to give shelter to sheep) is situated in a field East of Tongue House.,POST MEDIEVAL,POST MEDIEVAL,UNCERTAIN EVIDENCE,Bield.,4fc951fb-931a-4df5-a9cb-12df86bb79f8,"Structural remains of a bield of unknown date at Duddon, Dunnerdale-with-Seathwaite",yes,Structure(s),Medium,2,Probable,Point,1,N,N,1,1
39107,BIELD,36644,"Bield northwest of Ennerdale Forest, Ennerdale",,This bield (wall built to give shelter to sheep) is situated on the hillside northwest of Ennerdale Forest.,POST MEDIEVAL,POST MEDIEVAL,UNCERTAIN EVIDENCE,Bield.,fa8b2b59-bfd0-4d06-b193-55d02f352bc4,"Structural remains of a bield of unknown date at Ennerdale Forest, Ennerdale and Kinniside",yes,Structure(s),Medium,2,Probable,Point,1,N,N,1,1
39108,BIELD,36645,"Bield North of Ennerdale Forest, Ennerdale",,This bield (wall built to give shelter to sheep) is situated on the hillside North of Ennerdale Forest.,POST MEDIEVAL,POST MEDIEVAL,UNCERTAIN EVIDENCE,Bield.,4b1f182a-4898-4ea5-8e0b-2084779c36fe,"Structural remains of a sheepfold of unknown date at Ennerdale Forest, Ennerdale and Kinniside",yes,Structure(s),Medium,2,Probable,Point,1,N,N,1,1
39109,BIELD,36646,"Bield North of Ennerdale Forest, Ennerdale",,This bield (wall built to give shelter to sheep) is situated on the hillside North of Ennerdale Forest.,POST MEDIEVAL,POST MEDIEVAL,UNCERTAIN EVIDENCE,Bield.,13d75666-d902-44d6-8db0-342c45e6f7fc,"Structural remains of a bield of unknown date at Ennerdale Forest, Ennerdale and Kinniside",yes,Structure(s),Medium,2,Probable,Point,1,N,N,1,1
39110,BIELD,36647,"Bield North of Ennerdale Forest, Ennerdale",,This bield (wall built to give shelter to sheep) is situated on the hillside North of Ennerdale Forest.,POST MEDIEVAL,POST MEDIEVAL,UNCERTAIN EVIDENCE,Bield.,9b8480ae-e1f8-4d1d-a460-4e08122eba65,"Structural remains of a bield of unknown date at Ennerdale Forest, Ennerdale and Kinniside",yes,Structure(s),Medium,2,Probable,Point,1,N,N,1,1
39120,BIELD,36660,"Bield South of Revelin Crag, Ennerdale",,This bield (wall built to give shelter to sheep) is situated on the hillside South of Revelin Crag.,POST MEDIEVAL,POST MEDIEVAL,UNCERTAIN EVIDENCE,Bield.,f244ea22-86fa-4a74-82e0-46abcf529f06,"Structural remains of a bield of unknown date at Revelin Crag, Ennerdale and Kinniside",yes,Structure(s),Medium,2,Probable,Point,1,N,N,1,1
39172,RAMP,36877,"Livestock loading ramp northeast of Chimney Crag, Troutbeck",,"This unusual rectangular feature located in a field northeast of Chimney Crag is possibly a livestock loading ramp (inclined plane connecting two different levels, for use by vehicles).",POST MEDIEVAL,POST MEDIEVAL,EARTHWORK,An unusual rectangular feature 2m x 3m built into the slope of the hill creating a small raised platform located close to and orientated towards the gate into the field from the main road.,4dd3693c-b3fd-454b-93a4-9492c5e705af,"Above-ground remains of a livestock loading ramp of unknown date at Chimney Crag, Lakes",yes,Above-ground feature(s),Medium,2,Probable,Point,NA,N,N,1,1
39178,BIELD,36896,"Bield northeast of Side Pike, Great Langdale",,This bield (wall built to give shelter to sheep) is situated in a field northeast of Side Pike.,POST MEDIEVAL,POST MEDIEVAL,STRUCTURE,This bield measures 35m long x up to 1.5m high.,22aedd7d-1d7a-4bbd-a9c9-a6f7fb2eb1dd,"Structural remains of a bield of unknown date at Side Pike, Lakes",yes,Structure(s),Medium,2,Probable,Point,1,N,N,1,1
39180,BIELD,36898,"Bield near Dungeon Ghyll Force, Great Langdale",,This bield (wall built to give shelter to sheep) is situated in a field near to Dungeon Ghyll Force.,POST MEDIEVAL,POST MEDIEVAL,STRUCTURE,This bield is straight and measures 15m long.,044c6da2-2a9f-4798-ada6-0ad8c0d03483,"Structural remains of a bield of unknown date at Dungeon Ghyll Force, Lakes",yes,Structure(s),Medium,2,Probable,Point,1,N,N,1,1
39183,BIELD,36901,"Bield northwest of Millbeck, Great Langdale",,This L-shaped bield (wall built to give shelter to sheep) is situated in a field northwest of Millbeck.,POST MEDIEVAL,POST MEDIEVAL,STRUCTURE,This L-shaped shelter wall is 25m in length and over 1.5m high. It is adjacent to lower field wall.,6c8bcea1-d01f-44a2-898a-70a81df2c4b7,"Structural remains of a bield of unknown date at Millbeck, Lakes",yes,Structure(s),Medium,2,Probable,Point,1,N,N,1,1
39185,LEAD MINE,36929,"Beckside Mine (trial) near Lower Gatesgarth, Buttermere",,Beckside Mine trial lead mine is situated on the southeastern edge of Buttermere Lake.,POST MEDIEVAL,POST MEDIEVAL,EARTHWORK,"At the edge of Buttermere is a small car-parking area, the flattened spoil heap of two small Lead workings on the other side of the road (NY 192 154). The low level is 30' long and the upper 15', and both are well concealed (J Adams 1988, S1234).",7eb2c64d-39b1-4f01-919f-07fbc07de6e4,"Above-ground remains of a mine of unknown date at Lower Gatesgarth, Buttermere",yes,Above-ground feature(s),Medium,2,Probable,Point,NA,N,N,1,1
39188,GRAVEL PIT,36934,"Gravel pit near Buttermere Hotel, Buttermere",,"Gravel pit near Buttermere Hotel, Buttermere",POST MEDIEVAL,POST MEDIEVAL,UNCERTAIN EVIDENCE,Gravel pit.,8da34cf5-65db-46ea-9435-a262eb606771,Above-ground remains of a gravel pit of unknown date at Buttermere,yes,Above-ground feature(s),Low,2,Probable,Point,2,N,N,1,1
39200,COPPER MINE,36978,"Spot How Gill Copper mine, Eskdale",,Spot How Gill Copper mine is situated southeast of Penny Hill Farm.,POST MEDIEVAL,POST MEDIEVAL,EARTHWORK,"Situated at NY 205 004, this consists of two distinct workings. The lower is a level with an air shaft; the higher is a level with two branches. The entrance to the East branch is by the side of the gill. A few yards to the South, in higher ground, is a",8fd77379-1cb4-40d3-a964-b8a4c9e625a3,"Above-ground remains of a mine of unknown date at Spot How Gill, Eskdale",yes,Above-ground feature(s),Low,2,Probable,Point,2,N,N,1,1
39201,GRAVEL PIT,36983,"Gravel pit in Greenburn Valley, Grasmere",,"This gravel pit (steep-sided pit formed by, and for, the extraction of gravel) is located in Greenburn Valley.",POST MEDIEVAL,POST MEDIEVAL,UNCERTAIN EVIDENCE,Gravel pit.,1a9f1780-c434-4b9f-a22b-3b51f8df6bf9,"Above-ground remains of a modern gravel pit at Greenburn Valley, Grasmere",yes,Above-ground feature(s),Low,2,Probable,Point,2,N,N,1,1
39207,GRAVEL PIT,37007,"Gravel pit near Low High Snab, Derwentwater, Borrowdale",,"This gravel pit (steep-sided pit formed by, and for, the extraction of gravel) is situated near to Low High Snab.",POST MEDIEVAL,POST MEDIEVAL,UNCERTAIN EVIDENCE,Gravel pit.,2718254c-ba82-4e20-bd7c-d9823577ddd4,"Above-ground remains of a quarry of unknown date at Low High Snab, Above Derwent",yes,Above-ground feature(s),Low,2,Probable,Point,2,N,N,1,1
39210,LEAD MINE,37012,"Caiston Glen Lead mine near Caiston Beck, Ullswater",,Caiston Glen Lead mine is situated on the hillside near to Caiston Beck.,POST MEDIEVAL,POST MEDIEVAL,EARTHWORK,"The entrance to the main level is by the side of Caiston Beck (NY 394 100). It is about 26 yards long, and shows signs of Galena and Blende; southeast of the main trial is a smaller working (J Adams 1988, S1234).",2244ae93-a581-4f27-9a16-697098e2657a,"Above-ground and structural remains of a lead mine at Caiston Beck, Patterdale",yes,Structure(s) + above-ground feature(s),Low,2,Probable,Point,NA,N,N,1,1
39212,GRAVEL PIT,37014,"Gravel pit near Brother's Water, Ullswater",,"This gravel pit (steep-sided pit formed by, and for, the extraction of gravel) is situated near to Brother's Water.",POST MEDIEVAL,POST MEDIEVAL,UNCERTAIN EVIDENCE,Gravel pit.,e7a5f01d-61ae-4721-812c-270b924dc9b2,"Above-ground remains of a gravel pit of unknown date at Brother's Water, Patterdale",yes,Above-ground feature(s),Low,1,Possible,Point,2,N,N,1,1
39214,GRAVEL PIT,37025,"Gravel pit near Buckbarrow, Wasdale",,"This gravel pit (steep-sided pit formed by, and for, the extraction of gravel) is situated near to Buckbarrow.",POST MEDIEVAL,POST MEDIEVAL,UNCERTAIN EVIDENCE,Gravel pit.,773c5824-0ce3-4527-a8d6-78094e49e1dc,"Above-ground remains of a gravel pit of unknown date at Buckbarrow, Wasdale",yes,,,2,Probable,Point,2,N,N,1,1
39215,GRAVEL PIT,37029,"Gravel pit near Wast Water, Wasdale",,"This gravel pit (steep-sided pit formed by, and for, the extraction of gravel) is situated near to Wast Water.",POST MEDIEVAL,POST MEDIEVAL,UNCERTAIN EVIDENCE,Gravel pit.,f7c3cae9-2e4e-4ee5-964f-3ffd3d1be18d,"Above-ground remains of a gravel pit of unknown date at Wast Water, Wasdale",yes,Above-ground feature(s),Low,2,Probable,Point,2,N,N,1,1
39216,GRAVEL PIT,37030,"Gravel pit near Wast Water, Wasdale",,"This gravel pit (steep-sided pit formed by, and for, the extraction of gravel) is situated on the West bank of Wast Water.",POST MEDIEVAL,POST MEDIEVAL,UNCERTAIN EVIDENCE,Gravel pit.,afc80c2b-8e03-4df6-97e9-40bc58cffdcf,"Above-ground remains of a quarry of unknown date at Wast Water, Wasdale",yes,Above-ground feature(s),Low,2,Probable,Point,2,N,N,1,1
39217,GRAVEL PIT,37032,"Gravel pit near Windsor Farm, Wasdale",,"This gravel pit (steep-sided pit formed by, and for, the extraction of gravel) is situated near to Windsor Farm.",POST MEDIEVAL,POST MEDIEVAL,UNCERTAIN EVIDENCE,Gravel pit.,942839cf-4241-4df9-adf1-75bb1daf4f23,"Above-ground remains of a gravel pit of unknown date at Windsor Farm, Wasdale",yes,Above-ground feature(s),Low,2,Probable,Point,2,N,N,1,1
39225,GRAVEL PIT,37412,"Gravel pit Kidbeck Farm, Wasdale",,"The remains of a Post Medieval gravel pit (steep-sided pit formed by, and for, the extraction of gravel) recorded as an earthwork.",POST MEDIEVAL,POST MEDIEVAL,EARTHWORK,A quarry some 20m by 15 to 16m in size is situated at the side of the road. Edges of the quarry appear to be loose and suggest that gravel has been extracted from this site.,e82c7170-7cb5-47f8-9e11-af41e1ae62f3,"Above-ground remains of a post-medieval gravel pit at Kidbeck Farm, Wasdale",yes,Above-ground feature(s),Low,2,Probable,Point,2,N,N,1,1
39566,LEAT,38997,"Leat associated with Hartsop Hall lead mine in Low Wood, Howe Green Farm",,Leat (an artificial water channel) of post medieval to 20th century date.,POST MEDIEVAL,20TH CENTURY,STRUCTURE,"This leat links the former lead mine works with the dam located some distance to the East. The leat is cut into the ground and is between 0.3m to 0.6m in depth. The leat is commonly 1.3m in width. The leat is stone-lined in places, and in one location is",c06aea47-f070-4f7a-a13e-d4196c6284f5,"Above-ground remains of a post-medieval to modern leat at Low Wood, Patterdale",yes,Above-ground feature(s),Low,2,Probable,Point,NA,N,N,1,1
39578,GRAVEL PIT,39009,Small gravel quarry located to the south of Brothers Water,,"A gravel extraction site (a steep-sided pit formed by, and for, the extraction of gravel) of medieval to post medieval date.",MEDIEVAL,20TH CENTURY,STRUCTURE,"This quarry is located on the valley bottom to the South of Brothers Water and appears to have been quarried as a source of lake deposits, river cobbles and gravel. The quarry is roughly 8m by 6m in size, but is only 0.5m in depth (S2860).",17a3f64b-9117-46ac-a304-5902d9a2536e,"Above-ground remains of a quarry of unknown date at Brothers Water, Patterdale",yes,Above-ground feature(s),Low,2,Probable,Point,2,N,N,1,1
39620,BIELD,39051,"Bield wall, Hartsop Hall Farm",,A collapsed bield wall (a wall built to give shelter to sheep) of medieval to post medieval date.,MEDIEVAL,POST MEDIEVAL,STRUCTURE,"This collapsed bield wall is roughly 18m in length, there are some lengths of stacked material along the length of the wall standing to a height of 0.5m. However the majority of the bield has collapsed and has tumbled off to create a low linear mound of",acddf30b-61c6-4631-92d2-08643ddd7df2,"Above-ground remains of a medieval to post-medieval wall at Hartsop Hall Farm, Patterdale",yes,Above-ground feature(s),Medium,2,Probable,Point,1,N,N,1,1
39645,BIELD,39076,"Small bield wall on Little Hart Crag, Hartsop Hall Farm",,A bield (a wall built to give shelter to sheep) of post medieval date.,POST MEDIEVAL,POST MEDIEVAL,STRUCTURE,"This structure consists of a single wall built into the bottom of a scree slope at the base of a crag in order to create a small sheltered enclosure. The wall is roughly 12m in length and is very roughly built, it certainly appears to be a bield rather t",75964f11-b9d7-4747-ac9b-58f97e8a80ed,"Structural remains of a bield of unknown date at Little Hart Crag, Patterdale",yes,Structure(s),Medium,1,Possible,Point,1,N,N,1,1
39662,BIELD,39093,"Bield wall, Dovedale Beck, Hartsop Hall Farm",,A bield (a wall built to give shelter to sheep) of medieval date.,MEDIEVAL,MEDIEVAL,STRUCTURE,This bield wall is some 20m in length and is typical of the type of dry-stone walls style construction for bield walls on the high ground (S2860).,13d737da-9d21-4837-b4de-6d5f77be2a5f,"Structural remains of a medieval wall at Dovedale Beck, Patterdale",yes,Structure(s),Medium,1,Possible,Point,1,N,N,1,1
39683,BIELD,39117,"Bield, Brothers Water, Hartsop Hall Farm",,Bield (a wall built to give shelter to sheep) of medieval to post medieval date.,MEDIEVAL,POST MEDIEVAL,STRUCTURE,This feature is an odd looking pile of stones located in the top half of the bottom intake field to the East of Brothers Water. The bield or length of collapsed wall is 8m in length and curves into the slope of the hill rather than simply running up and,f5bf0cab-37de-4958-a6ab-f50ed015e706,"Structural remains of a sheepfold of unknown date at Brothers Water, Patterdale",yes,Structure(s),Medium,2,Probable,Point,1,N,N,1,1
39686,BIELD,39120,"Ruined Sheepfold or Bield, Brothers Water, Hartsop Hall Farm",,Ruined sheepfold (a pen or enclosure used for containing sheep) or bield (a wall built to give shelter to sheep) of medieval to post medieval date.,MEDIEVAL,POST MEDIEVAL,STRUCTURE,This bield or ruined sheep fold structure is concentrated around three large earthfast boulders. The remaining wall runs for a distance of 12m downslope and is roughly 4m in width and stands to a height of 0.6m (S2860).,2706afb8-3346-426e-a25c-eab8cf8695f6,"Structural remains of a sheepfold of unknown date at Brothers Water, Patterdale",yes,Structure(s),Medium,2,Probable,Point,1,N,N,1,1
39714,BIELD,39155,"Bields, north-west of Pikeside Farm, Duddon",,Two ruined bields (walls built to give shelter to sheep) of post medieval date.,POST MEDIEVAL,POST MEDIEVAL,STRUCTURE,Two small ruined bield walls located on the fell to the East of the copper mine level recorded as National Trust site 27339 (S2953).,3c82d45e-791e-47d0-8a26-37b36f77b4a9,"Structural remains of post-medieval bields at Pikeside Farm, Ulpha",yes,Structure(s),Medium,2,Probable,Point,1,N,N,1,1
39715,BIELD,39156,"Bield, north-west of Pikeside Farm, Duddon",,A bield (a wall built to give shelter to sheep) of post medieval date.,POST MEDIEVAL,POST MEDIEVAL,STRUCTURE,Stone bield wall in the enclosed fell to the North of Pikeside Farm. This bield is L-shaped and would have provided shelter for the stock (S2953).,40236c8f-9862-429d-8012-42a9ee4d07ec,"Structural remains of a post-medieval bield at Pikeside Farm, Ulpha",yes,Structure(s),Medium,2,Probable,Point,1,N,N,1,1
39716,BIELD,39157,"Bield, north-west of Pikeside Farm, Duddon",,A bield (a wall built to give shelter to sheep) of post medieval date.,POST MEDIEVAL,POST MEDIEVAL,STRUCTURE,This bield is located on the enclosed fell to the North of Pikeside Farm. The bield is L-shaped and would have provided shelter for stock (S2953).,6768dbe3-de80-421b-b229-8d4f40d15fb2,"Structural remains of a post-medieval bield at Pikeside Farm, Ulpha",yes,Structure(s),Medium,2,Probable,Point,1,N,N,1,1
39717,BIELD,39158,"Bield, north-west of Pikeside Farm, Duddon",,A bield (a wall built to give shelter to sheep) of post medieval date.,POST MEDIEVAL,POST MEDIEVAL,STRUCTURE,Bield located on the enclosed land to the North of Pikeside Farm. This bield appears as a single course of walling located on a crag below The Pike (S2953).,faa2ed52-550b-4a40-b8e1-ca08682a5012,"Structural remains of a post-medieval bield at Pikeside Farm, Ulpha",yes,Structure(s),Medium,2,Probable,Point,1,N,N,1,1
39718,BIELD,39159,"Bield, south-west of Pikeside Farm, Duddon",,A bield (a wall built to give shelter to sheep) of post medieval date.,POST MEDIEVAL,POST MEDIEVAL,STRUCTURE,Bield located in an intake field to the South of Pikeside Farm. This bield is a single wall built to provide shelter for ther stock (S2953).,8fab581f-57a9-4047-a3c3-32e2839adf21,"Structural remains of a post-medieval bield at Pikeside Farm, Ulpha",yes,Structure(s),Medium,2,Probable,Point,1,N,N,1,1
39720,BIELD,39160,"Bield, south of Pikeside Farm, Duddon",,A bield (a wall built to give shelter to sheep) of post medieval date.,POST MEDIEVAL,POST MEDIEVAL,STRUCTURE,Bield located in an intake field to the South of Pikeside Farm (S2953).,f2ec9990-71c0-4186-8ac0-2c03516e7264,"Above-ground and structural remains of a post-medieval bield at Pikeside Farm, Ulpha",yes,Structure(s) + above-ground feature(s),Medium,2,Probable,Point,1,N,N,1,1
39723,BIELD,39166,"Bield, south of Hartsop Hall Farm",,Ruined bield (a wall built to give shelter to sheep) of medieval to post medieval date.,MEDIEVAL,POST MEDIEVAL,STRUCTURE,"This bield is now visible just as a low foundation roughly 10m long x 2m in width. The wall stands up to 0.2m in height (S2860, E1471).",fd398b35-81f6-4f24-8006-41c25cfa80aa,"Above-ground remains of a bield and cairn of unknown date at Hartsop Hall Farm, Patterdale",yes,Above-ground feature(s),Medium,2,Probable,Point,1,N,N,1,1
39727,BIELD,39173,"Bield, south of Hartsop Hall Farm",,Bield (a wall built to give shelter to sheep) of medieval to post medieval date.,MEDIEVAL,POST MEDIEVAL,STRUCTURE,This bield or shelter wall is roughly 18m in length and 0.8m in height. The bield wall is located on the steeply sloping valley side close to the top edge of the most southerly intake field belonging to Hartsop Hall Farm (S2860).,1e578cbf-412f-4a8c-a861-39de2586a2c6,"Structural remains of a bield of unknown date at Kirkstone Beck, Patterdale",yes,Structure(s),Medium,2,Probable,Point,1,N,N,1,1
39770,BIELD,39219,"Bield, north of Caudale Head, Howe Green Farm",,A bield (a wall built to give shelter to sheep) of post medieval date.,POST MEDIEVAL,POST MEDIEVAL,STRUCTURE,This bield is roughly 0.5m high and runs for a distance of roughly 4m. The bield includes a large orthostat in its build and is made of material roughly 0.3m in size (S2860).,32c0d831-fb35-45d5-b75d-da0b4988d8de,"Structural remains of a post-medieval bield at Caudale Head, Patterdale",yes,Structure(s),Medium,2,Probable,Point,1,N,N,1,1
